{
  "default": true,
  "_aid": 857,
  "_build": 5851,
  "_name": "Bolzano/Bozen",
  "_region": "Triveneto",
  "elemente": [
    {
      "name": "Bressanone",
      "typ": "Bf",
      "auto": true,
      "sichtbar": true,
      "flags": ""
    },
    {
      "name": "Chiusa",
      "typ": "Bf",
      "auto": true,
      "sichtbar": true,
      "flags": ""
    },
    {
      "name": "E-A Merano",
      "typ": "Bf",
      "auto": true,
      "sichtbar": true,
      "flags": ""
    },
    {
      "name": "Gbf Süd",
      "typ": "Bf",
      "auto": true,
      "sichtbar": true,
      "flags": ""
    },
    {
      "name": "Laives",
      "typ": "Bf",
      "auto": true,
      "sichtbar": true,
      "flags": ""
    },
    {
      "name": "Ponte",
      "typ": "Bf",
      "auto": true,
      "sichtbar": true,
      "flags": ""
    },
    {
      "name": "Prato",
      "typ": "Bf",
      "auto": true,
      "sichtbar": true,
      "flags": ""
    },
    {
      "name": "Bolzano",
      "typ": "Bf",
      "auto": false,
      "sichtbar": true,
      "flags": ""
    },
    {
      "name": "3",
      "typ": "Bs",
      "auto": false,
      "sichtbar": true,
      "flags": "",
      "stamm": "3",
      "gleise": 1
    },
    {
      "name": "5",
      "typ": "Bs",
      "auto": false,
      "sichtbar": true,
      "flags": "",
      "stamm": "3",
      "gleise": 1
    },
    {
      "name": "4",
      "typ": "Bs",
      "auto": false,
      "sichtbar": true,
      "flags": "",
      "stamm": "3",
      "gleise": 1
    },
    {
      "name": "1",
      "typ": "Bs",
      "auto": false,
      "sichtbar": true,
      "flags": "",
      "stamm": "3",
      "gleise": 1
    },
    {
      "name": "2",
      "typ": "Bs",
      "auto": false,
      "sichtbar": true,
      "flags": "",
      "stamm": "3",
      "gleise": 1
    },
    {
      "name": "8",
      "typ": "Bs",
      "auto": false,
      "sichtbar": true,
      "flags": "",
      "stamm": "3",
      "gleise": 1
    },
    {
      "name": "7",
      "typ": "Bs",
      "auto": false,
      "sichtbar": true,
      "flags": "",
      "stamm": "3",
      "gleise": 1
    },
    {
      "name": "9",
      "typ": "Bs",
      "auto": false,
      "sichtbar": true,
      "flags": "",
      "stamm": "3",
      "gleise": 1
    },
    {
      "name": "6",
      "typ": "Bs",
      "auto": false,
      "sichtbar": true,
      "flags": "",
      "stamm": "3",
      "gleise": 1
    },
    {
      "name": "3",
      "typ": "Gl",
      "auto": false,
      "sichtbar": true,
      "flags": "",
      "stamm": "3",
      "gleise": 1
    },
    {
      "name": "3G",
      "typ": "Gl",
      "auto": false,
      "sichtbar": true,
      "flags": "",
      "stamm": "3",
      "gleise": 1
    },
    {
      "name": "5",
      "typ": "Gl",
      "auto": false,
      "sichtbar": true,
      "flags": "",
      "stamm": "5",
      "gleise": 1
    },
    {
      "name": "4",
      "typ": "Gl",
      "auto": false,
      "sichtbar": true,
      "flags": "",
      "stamm": "4",
      "gleise": 1
    },
    {
      "name": "4G",
      "typ": "Gl",
      "auto": false,
      "sichtbar": true,
      "flags": "",
      "stamm": "4",
      "gleise": 1
    },
    {
      "name": "1",
      "typ": "Gl",
      "auto": false,
      "sichtbar": true,
      "flags": "",
      "stamm": "1",
      "gleise": 1
    },
    {
      "name": "1G",
      "typ": "Gl",
      "auto": false,
      "sichtbar": true,
      "flags": "",
      "stamm": "1",
      "gleise": 1
    },
    {
      "name": "2G",
      "typ": "Gl",
      "auto": false,
      "sichtbar": true,
      "flags": "",
      "stamm": "2",
      "gleise": 1
    },
    {
      "name": "8G",
      "typ": "Gl",
      "auto": false,
      "sichtbar": true,
      "flags": "",
      "stamm": "8",
      "gleise": 1
    },
    {
      "name": "7G",
      "typ": "Gl",
      "auto": false,
      "sichtbar": true,
      "flags": "",
      "stamm": "7",
      "gleise": 1
    },
    {
      "name": "9G",
      "typ": "Gl",
      "auto": false,
      "sichtbar": true,
      "flags": "",
      "stamm": "9",
      "gleise": 1
    },
    {
      "name": "6",
      "typ": "Gl",
      "auto": false,
      "sichtbar": true,
      "flags": "",
      "stamm": "6",
      "gleise": 1
    },
    {
      "name": "1T",
      "typ": "Bs",
      "auto": false,
      "sichtbar": true,
      "flags": "",
      "stamm": "1",
      "gleise": 1
    },
    {
      "name": "37",
      "typ": "Bs",
      "auto": false,
      "sichtbar": true,
      "flags": "",
      "stamm": "37",
      "gleise": 1
    },
    {
      "name": "38",
      "typ": "Bs",
      "auto": false,
      "sichtbar": true,
      "flags": "",
      "stamm": "37",
      "gleise": 1
    },
    {
      "name": "40",
      "typ": "Bs",
      "auto": false,
      "sichtbar": true,
      "flags": "",
      "stamm": "37",
      "gleise": 1
    },
    {
      "name": "39",
      "typ": "Bs",
      "auto": false,
      "sichtbar": true,
      "flags": "",
      "stamm": "37",
      "gleise": 1
    },
    {
      "name": "37a",
      "typ": "Gl",
      "auto": false,
      "sichtbar": true,
      "flags": "",
      "stamm": "37",
      "gleise": 1
    },
    {
      "name": "37b",
      "typ": "Gl",
      "auto": false,
      "sichtbar": true,
      "flags": "",
      "stamm": "37",
      "gleise": 1
    },
    {
      "name": "38a",
      "typ": "Gl",
      "auto": false,
      "sichtbar": true,
      "flags": "",
      "stamm": "38",
      "gleise": 1
    },
    {
      "name": "38b",
      "typ": "Gl",
      "auto": false,
      "sichtbar": true,
      "flags": "",
      "stamm": "38",
      "gleise": 1
    },
    {
      "name": "40a",
      "typ": "Gl",
      "auto": false,
      "sichtbar": true,
      "flags": "",
      "stamm": "40",
      "gleise": 1
    },
    {
      "name": "40b",
      "typ": "Gl",
      "auto": false,
      "sichtbar": true,
      "flags": "",
      "stamm": "40",
      "gleise": 1
    },
    {
      "name": "39a",
      "typ": "Gl",
      "auto": false,
      "sichtbar": true,
      "flags": "",
      "stamm": "39",
      "gleise": 1
    },
    {
      "name": "39b",
      "typ": "Gl",
      "auto": false,
      "sichtbar": true,
      "flags": "",
      "stamm": "39",
      "gleise": 1
    },
    {
      "name": "43",
      "typ": "Gl",
      "auto": false,
      "sichtbar": true,
      "flags": "",
      "stamm": "43",
      "gleise": 1
    },
    {
      "name": "42",
      "typ": "Gl",
      "auto": false,
      "sichtbar": true,
      "flags": "",
      "stamm": "42",
      "gleise": 1
    },
    {
      "name": "41",
      "typ": "Gl",
      "auto": false,
      "sichtbar": true,
      "flags": "",
      "stamm": "41",
      "gleise": 1
    },
    {
      "name": "67",
      "typ": "Gl",
      "auto": false,
      "sichtbar": true,
      "flags": "",
      "stamm": "67",
      "gleise": 1
    },
    {
      "name": "Güter",
      "typ": "Gl",
      "auto": false,
      "sichtbar": true,
      "flags": "",
      "stamm": "Güter",
      "gleise": 1
    },
    {
      "name": "Rola 1",
      "typ": "Gl",
      "auto": false,
      "sichtbar": true,
      "flags": "",
      "stamm": "Rola 1",
      "gleise": 1
    },
    {
      "name": "61",
      "typ": "Gl",
      "auto": false,
      "sichtbar": true,
      "flags": "",
      "stamm": "61",
      "gleise": 1
    },
    {
      "name": "66",
      "typ": "Gl",
      "auto": false,
      "sichtbar": true,
      "flags": "",
      "stamm": "66",
      "gleise": 1
    },
    {
      "name": "68",
      "typ": "Gl",
      "auto": false,
      "sichtbar": true,
      "flags": "",
      "stamm": "68",
      "gleise": 1
    },
    {
      "name": "Rola 2",
      "typ": "Gl",
      "auto": false,
      "sichtbar": true,
      "flags": "",
      "stamm": "Rola 2",
      "gleise": 1
    },
    {
      "name": "65",
      "typ": "Bs",
      "auto": false,
      "sichtbar": true,
      "flags": "",
      "stamm": "65",
      "gleise": 1
    },
    {
      "name": "65",
      "typ": "Gl",
      "auto": false,
      "sichtbar": true,
      "flags": "",
      "stamm": "65",
      "gleise": 1
    },
    {
      "name": "84",
      "typ": "Bs",
      "auto": false,
      "sichtbar": true,
      "flags": "",
      "stamm": "84",
      "gleise": 1
    },
    {
      "name": "84",
      "typ": "Gl",
      "auto": false,
      "sichtbar": true,
      "flags": "",
      "stamm": "84",
      "gleise": 1
    },
    {
      "name": "Bressanone 3",
      "typ": "Bft",
      "auto": true,
      "sichtbar": true,
      "flags": "",
      "stamm": "Bressanone"
    },
    {
      "name": "Bressanone 3",
      "typ": "Bs",
      "auto": true,
      "sichtbar": true,
      "flags": "",
      "stamm": "Bressanone 3",
      "gleise": 1
    },
    {
      "name": "Bressanone 4",
      "typ": "Bs",
      "auto": true,
      "sichtbar": true,
      "flags": "",
      "stamm": "Bressanone 3",
      "gleise": 1
    },
    {
      "name": "Bressanone 1",
      "typ": "Bs",
      "auto": true,
      "sichtbar": true,
      "flags": "",
      "stamm": "Bressanone 3",
      "gleise": 1
    },
    {
      "name": "Bressanone 2",
      "typ": "Bs",
      "auto": true,
      "sichtbar": true,
      "flags": "",
      "stamm": "Bressanone 3",
      "gleise": 1
    },
    {
      "name": "Bressanone 5",
      "typ": "Bs",
      "auto": true,
      "sichtbar": true,
      "flags": "",
      "stamm": "Bressanone 3",
      "gleise": 1
    },
    {
      "name": "Bressanone 3G",
      "typ": "Gl",
      "auto": true,
      "sichtbar": true,
      "flags": "",
      "stamm": "Bressanone 3",
      "gleise": 1
    },
    {
      "name": "Bressanone 3",
      "typ": "Gl",
      "auto": true,
      "sichtbar": true,
      "flags": "",
      "stamm": "Bressanone 3",
      "gleise": 1
    },
    {
      "name": "Bressanone 4G",
      "typ": "Gl",
      "auto": true,
      "sichtbar": true,